{
  "event_id": "sismo-eje-cafetero-2026",
  "name": {
    "en": "2026 Eje Cafetero seismic emergency",
    "es": "Emergencia sísmica del Eje Cafetero 2026"
  },
  "started": "2026-08-10",
  "ended": null,
  "notes": "M7.4, epicenter San José del Palmar (Chocó), 2026-08-10. Reported figures with named sources (founding record, DECISIONS M7): 190 dead / 1,679 injured (Infobae, 2026-08-11); 260 missing and 58 collapsed structures in Pereira/Dosquebradas (El Espectador). The founding event; places outlive it by design."
}
